{
  "$schema": "../scene.schema.json",
  "format": "design3d.scene",
  "version": "0.1.0",
  "id": "quintal-com-piscina",
  "name": "Quintal com piscina",
  "units": "m",
  "meta": {
    "description": "Terreno externo de 12 x 15 m com gramado, deck, piscina, caminho e muro com portão.",
    "tags": ["exemplo", "externo"],
    "locale": "pt-BR"
  },
  "environment": { "timeOfDay": "11:00", "northDeg": 30, "sky": "partly-cloudy", "mood": "bright" },
  "levels": [],
  "site": {
    "boundary": [[0, 0], [12, 0], [12, 15], [0, 15]],
    "groundMaterial": "ground/grass",
    "zones": [
      { "id": "z-deck", "name": "Deck", "kind": "deck", "polygon": [[2, 2], [10, 2], [10, 5], [2, 5]], "material": "wood/deck-cumaru", "elevation": 0.1 },
      { "id": "z-piscina", "name": "Piscina", "kind": "pool", "polygon": [[3, 5.5], [9, 5.5], [9, 9], [3, 9]], "material": "water/pool", "depth": 1.4, "edgeMaterial": "stone/travertine" },
      { "id": "z-caminho", "name": "Caminho", "kind": "paving", "polygon": [[5.4, 9.5], [6.6, 9.5], [6.6, 15], [5.4, 15]], "material": "stone/slate" },
      { "id": "z-canteiro", "name": "Canteiro", "kind": "garden-bed", "polygon": [[0.3, 10], [4, 10], [4, 14.7], [0.3, 14.7]], "material": "ground/soil" }
    ],
    "walls": [
      { "id": "m-fundo", "kind": "solid", "start": [0, 0], "end": [12, 0], "height": 2.2, "thickness": 0.15, "finish": { "left": "paint/exterior-white", "right": "stone/slate" } },
      { "id": "m-frente", "kind": "fence", "start": [12, 15], "end": [0, 15], "height": 1.8, "thickness": 0.05, "finish": { "left": "wood/walnut", "right": "wood/walnut" } }
    ],
    "openings": [
      { "id": "a-portao", "wallId": "m-frente", "kind": "passage", "offset": 6.0, "width": 1.2, "height": 1.8 }
    ],
    "objects": [
      { "id": "o-espreguicadeira-1", "catalogId": "outdoor/sun-lounger", "position": [3.5, 0.1, 3.5], "rotationDeg": 0, "materials": { "fabric": "fabric/linen" } },
      { "id": "o-espreguicadeira-2", "catalogId": "outdoor/sun-lounger", "position": [5.0, 0.1, 3.5], "rotationDeg": 0, "materials": { "fabric": "fabric/linen" } },
      { "id": "o-guarda-sol", "catalogId": "outdoor/umbrella", "position": [4.25, 0.1, 2.6] },
      { "id": "o-arvore-1", "name": "Ipê amarelo", "catalogId": "plant/tree-medium", "position": [10.5, 0, 12.5], "dimensions": { "width": 4, "height": 6, "depth": 4 } },
      { "id": "o-palmeira", "catalogId": "plant/palm", "position": [1.2, 0, 1.2] }
    ]
  },
  "views": [
    { "id": "v-geral", "name": "Vista geral", "position": [20, 14, 22], "target": [6, 0, 7.5] }
  ]
}
